{
  "felles": {
    "søkerNavn": "Dolly Duck",
    "søkerPersonnummer": "300220 12345",
    "brevDato": "4. mai 2021",
    "erAutomatiskBehandlet": true,
    "saksnummer": "123456789",
    "erUtkast": false
  },
  "harSøktOmNyPeriode": true,
  "planlagtOppstartDato": "1. april 2022",
  "kanBehandlesDato": "1. mars 2021",
  "klagefristUker": 6
}
